{
  "$schema": "https://json-schema.org/draft/2020-12/schema",
  "$id": "bug-report.schema.json",
  "title": "Verifier Bug Report",
  "type": "object",
  "required": ["verifier_status", "bugs"],
  "properties": {
    "agent_id": {"type": "string", "pattern": "^wave-[0-9]+-agent-[0-9]+$"},
    "task_id": {"type": "string", "pattern": "^[A-Za-z0-9][A-Za-z0-9._:-]*$", "description": "Stable DAG task identifier. Optional for backwards-compatible wave verifier reports; required by DAG task verification."},
    "task_title": {"type": "string"},
    "verifier_status": {"type": "string", "enum": ["CLEAN", "BUGS_FOUND", "UNVERIFIABLE"]},
    "base_commit": {"type": ["string", "null"], "description": "DAG task base commit used to identify stale-base evidence."},
    "task_commit": {"type": ["string", "null"], "description": "DAG task commit independently verified by this report."},
    "verification_scope": {"type": "array", "items": {"type": "string"}, "uniqueItems": true, "description": "DAG paths included in scoped checks and stale-base review."},
    "ownership_evidence": {"type": ["object", "null"], "description": "Complete diff ownership evidence for a DAG task. A missing or non-conforming result is not a clean ownership decision.", "required": ["status", "artifact_path", "changed_paths"], "properties": {"status": {"type": "string", "enum": ["PASS", "FAIL", "STALE", "UNVERIFIABLE"]}, "artifact_path": {"type": "string", "minLength": 1}, "changed_paths": {"type": "array", "items": {"type": "object", "required": ["path", "change_type", "declared"], "properties": {"path": {"type": "string", "minLength": 1}, "old_path": {"type": ["string", "null"]}, "change_type": {"type": "string", "enum": ["added", "modified", "deleted", "renamed", "copied", "generated", "shared"]}, "declared": {"type": "boolean"}, "ownership": {"type": "string", "enum": ["owned", "shared", "undeclared"]}}}}}},
    "deterministic_checks": {"type": ["object", "null"], "description": "DAG scoped deterministic-check result preserved for integration eligibility.", "required": ["status", "artifact_path"], "properties": {"status": {"type": "string", "enum": ["PASS", "FAIL", "UNVERIFIABLE"]}, "artifact_path": {"type": "string", "minLength": 1}}},
    "bugs": {
      "type": "array",
      "items": {
        "type": "object",
        "required": ["bug_id", "severity", "category", "title", "file", "evidence", "expected", "suggested_fix"],
        "properties": {
          "bug_id": {"type": "string", "pattern": "^wave-[0-9]+-agent-[0-9]+-bug-[0-9]+$"},
          "severity": {"type": "string", "enum": ["P0", "P1", "P2", "P3"]},
          "category": {"type": "string", "enum": ["missing_requirement", "incorrect_implementation", "scope_drift", "broken_existing"]},
          "title": {"type": "string", "maxLength": 500, "description": "Pre-1.13.0 artifacts uncapped. One-line bug summary."},
          "file": {"type": "string"},
          "line": {"type": ["integer", "null"]},
          "evidence": {"type": "string", "maxLength": 4000, "description": "Pre-1.13.0 artifacts uncapped. What the agent actually wrote or did (code snippet, log excerpt, or path + line range)."},
          "expected": {"type": "string", "maxLength": 4000, "description": "Pre-1.13.0 artifacts uncapped. What should have happened instead (code snippet, correct behavior, or acceptance criterion reference)."},
          "suggested_fix": {"type": "string", "maxLength": 4000, "description": "Pre-1.13.0 artifacts uncapped. Concrete fix: code change, file path + edit, or implementation approach."}
        }
      }
    }
  },
  "allOf": [
    {
      "anyOf": [
        {"required": ["agent_id", "task_title"]},
        {"required": ["task_id", "base_commit", "task_commit", "verification_scope", "ownership_evidence", "deterministic_checks"]}
      ]
    }
  ]
}
